{
  "$schema": "../../Schemas/economy-resource.schema.json",
  "schema": "moyva.economy-resource",
  "version": 1,
  "id": "herb-green-food-resources",
  "model": "economy-resource",
  "displayName": "Herb-green",
  "category": "Food",
  "icon": {
    "$asset": "asset.sprite.16x16-items-sheet-234.62d7684d",
    "editorPath": "Assets/Moyva/Art/Sprites/16x16 Pixel Art Item Icons/16x16 items sheet.png",
    "required": true
  },
  "stackLimit": 32,
  "weightGrams": 1000,
  "migration": {
    "sourceAssetGuid": "fa3719f58ea9441fb709111f4b9cba34",
    "sourceAssetPath": "Assets/Moyva/Data/ScriptableObjects/Economy/Resources/Honeycomb.asset",
    "sourceHash": "ab5429d3aa1d2f4c921681b41413cfd3534207bd6a4f581a47ccc68c3cd0d630"
  }
}
