{
  "$schema": "../../Schemas/economy-resource.schema.json",
  "schema": "moyva.economy-resource",
  "version": 1,
  "id": "crystal-cluster-materials-resources",
  "model": "economy-resource",
  "displayName": "Crystal-cluster",
  "category": "Materials",
  "icon": {
    "$asset": "asset.sprite.16x16-items-sheet-11.62d7684d",
    "editorPath": "Assets/Moyva/Art/Sprites/16x16 Pixel Art Item Icons/16x16 items sheet.png",
    "required": true
  },
  "stackLimit": 32,
  "weightGrams": 1000,
  "migration": {
    "sourceAssetGuid": "601102c3a7d24feaba52ebeb74ba3550",
    "sourceAssetPath": "Assets/Moyva/Data/ScriptableObjects/Economy/Resources/Crystal-cluster.asset",
    "sourceHash": "aee7cdc8dcce1be63a8c5a5f04b428ca17b94bd2bbe79d6bcecf06b1026225ee"
  }
}
