{
  "$schema": "../../Schemas/economy-resource.schema.json",
  "schema": "moyva.economy-resource",
  "version": 1,
  "id": "banana-food-resources",
  "model": "economy-resource",
  "displayName": "Banana",
  "category": "Food",
  "icon": {
    "$asset": "asset.sprite.16x16-items-sheet-233.62d7684d",
    "editorPath": "Assets/Moyva/Art/Sprites/16x16 Pixel Art Item Icons/16x16 items sheet.png",
    "required": true
  },
  "stackLimit": 32,
  "weightGrams": 1000,
  "migration": {
    "sourceAssetGuid": "de8814bb67ba4b3f96fbb701a4b8c6b3",
    "sourceAssetPath": "Assets/Moyva/Data/ScriptableObjects/Economy/Resources/Milk-bucket.asset",
    "sourceHash": "c6697777e25e124cc0f35ab6fe266221733c65784c63d7454c418663cabb32e0"
  }
}
