{
  "$schema": "../../Schemas/economy-resource.schema.json",
  "schema": "moyva.economy-resource",
  "version": 1,
  "id": "cabbage-food-resources",
  "model": "economy-resource",
  "displayName": "Cabbage",
  "category": "Food",
  "icon": {
    "$asset": "asset.sprite.16x16-items-sheet-46.62d7684d",
    "editorPath": "Assets/Moyva/Art/Sprites/16x16 Pixel Art Item Icons/16x16 items sheet.png",
    "required": true
  },
  "stackLimit": 32,
  "weightGrams": 1000,
  "migration": {
    "sourceAssetGuid": "dec93e436b2a4539ad160870b489fc39",
    "sourceAssetPath": "Assets/Moyva/Data/ScriptableObjects/Economy/Resources/Cabbage.asset",
    "sourceHash": "8a6ede67085e515a53160006d16de2da5b8f7e864a341cfad4be04a2231f708a"
  }
}
