{
  "$schema": "../../Schemas/economy-resource.schema.json",
  "schema": "moyva.economy-resource",
  "version": 1,
  "id": "gold-chunks-materials-resources",
  "model": "economy-resource",
  "displayName": "Gold-chunks",
  "category": "Materials",
  "icon": {
    "$asset": "asset.sprite.16x16-items-sheet-69.62d7684d",
    "editorPath": "Assets/Moyva/Art/Sprites/16x16 Pixel Art Item Icons/16x16 items sheet.png",
    "required": true
  },
  "stackLimit": 32,
  "weightGrams": 1000,
  "migration": {
    "sourceAssetGuid": "4864036ac38d408e8f59a38bf41df9d9",
    "sourceAssetPath": "Assets/Moyva/Data/ScriptableObjects/Economy/Resources/Gold-chunks.asset",
    "sourceHash": "3e75d567128bb6cd632df7d69edb8e7e6937c3f2b6cad7f3a537dd942992d5e6"
  }
}
