{
  "$schema": "../../Schemas/economy-resource.schema.json",
  "schema": "moyva.economy-resource",
  "version": 1,
  "id": "herbs-food-resources",
  "model": "economy-resource",
  "displayName": "Herbs",
  "category": "Food",
  "icon": {
    "$asset": "asset.sprite.16x16-items-sheet-232.62d7684d",
    "editorPath": "Assets/Moyva/Art/Sprites/16x16 Pixel Art Item Icons/16x16 items sheet.png",
    "required": true
  },
  "stackLimit": 32,
  "weightGrams": 1000,
  "migration": {
    "sourceAssetGuid": "52b74c4d7c61430e9d12d5bef5460c8e",
    "sourceAssetPath": "Assets/Moyva/Data/ScriptableObjects/Economy/Resources/Herbs.asset",
    "sourceHash": "6dbcf74c690e1f9cd2b14f7ba816486f87cbe490c51598b3ff52961dba1d2d58"
  }
}
