{
  "$schema": "../../Schemas/economy-resource.schema.json",
  "schema": "moyva.economy-resource",
  "version": 1,
  "id": "amethyst-materials-resources",
  "model": "economy-resource",
  "displayName": "Amethyst",
  "category": "Materials",
  "icon": {
    "$asset": "asset.sprite.16x16-items-sheet-13.62d7684d",
    "editorPath": "Assets/Moyva/Art/Sprites/16x16 Pixel Art Item Icons/16x16 items sheet.png",
    "required": true
  },
  "stackLimit": 32,
  "weightGrams": 1000,
  "migration": {
    "sourceAssetGuid": "b4e763f76d514f49b106f0998d622e4d",
    "sourceAssetPath": "Assets/Moyva/Data/ScriptableObjects/Economy/Resources/Amethyst.asset",
    "sourceHash": "abbd2d33620e7b47547bff4b0972ab1d02fb484a65560b2a86578316acae02dc"
  }
}
