{
  "$schema": "../../Schemas/economy-resource.schema.json",
  "schema": "moyva.economy-resource",
  "version": 1,
  "id": "green-gem-materials-resources",
  "model": "economy-resource",
  "displayName": "Green-gem",
  "category": "Materials",
  "icon": {
    "$asset": "asset.sprite.16x16-items-sheet-17.62d7684d",
    "editorPath": "Assets/Moyva/Art/Sprites/16x16 Pixel Art Item Icons/16x16 items sheet.png",
    "required": true
  },
  "stackLimit": 32,
  "weightGrams": 1000,
  "migration": {
    "sourceAssetGuid": "27a5ff04a0c04f0fbf4e1d6a2f7fe1d1",
    "sourceAssetPath": "Assets/Moyva/Data/ScriptableObjects/Economy/Resources/Blue-gem.asset",
    "sourceHash": "af8c53ab47fcb8deb3db382d20bf111130022159e3bd4d89f7ef68d654d36c84"
  }
}
