{
  "$schema": "../../Schemas/economy-resource.schema.json",
  "schema": "moyva.economy-resource",
  "version": 1,
  "id": "steel-block-materials-resources",
  "model": "economy-resource",
  "displayName": "Steel-block",
  "category": "Materials",
  "icon": {
    "$asset": "asset.sprite.16x16-items-sheet-33.62d7684d",
    "editorPath": "Assets/Moyva/Art/Sprites/16x16 Pixel Art Item Icons/16x16 items sheet.png",
    "required": true
  },
  "stackLimit": 32,
  "weightGrams": 1000,
  "migration": {
    "sourceAssetGuid": "c81a90938db44b1984a51acae94446e8",
    "sourceAssetPath": "Assets/Moyva/Data/ScriptableObjects/Economy/Resources/Steel-block.asset",
    "sourceHash": "ded1870aebc103d23f8cb518b3dff2a31a902140642a473a2c739c490ec31554"
  }
}
