{
  "$schema": "../../Schemas/economy-resource.schema.json",
  "schema": "moyva.economy-resource",
  "version": 1,
  "id": "red-cloth-materials-resources",
  "model": "economy-resource",
  "displayName": "Red-cloth",
  "category": "Materials",
  "icon": {
    "$asset": "asset.sprite.16x16-items-sheet-65.62d7684d",
    "editorPath": "Assets/Moyva/Art/Sprites/16x16 Pixel Art Item Icons/16x16 items sheet.png",
    "required": true
  },
  "stackLimit": 32,
  "weightGrams": 1000,
  "migration": {
    "sourceAssetGuid": "9aea2c120f7d47b9a3656f0949b9b837",
    "sourceAssetPath": "Assets/Moyva/Data/ScriptableObjects/Economy/Resources/Pearl.asset",
    "sourceHash": "da634572793d5808753ae248aaad6f020adc5130e1940357961843584a595cec"
  }
}
