{
  "$schema": "../../Schemas/economy-resource.schema.json",
  "schema": "moyva.economy-resource",
  "version": 1,
  "id": "rope-materials-resources",
  "model": "economy-resource",
  "displayName": "Rope",
  "category": "Materials",
  "icon": {
    "$asset": "asset.sprite.16x16-items-sheet-28.62d7684d",
    "editorPath": "Assets/Moyva/Art/Sprites/16x16 Pixel Art Item Icons/16x16 items sheet.png",
    "required": true
  },
  "stackLimit": 32,
  "weightGrams": 1000,
  "migration": {
    "sourceAssetGuid": "1cdbbcd2bf03421985f7d3861e6fdb46",
    "sourceAssetPath": "Assets/Moyva/Data/ScriptableObjects/Economy/Resources/Rope.asset",
    "sourceHash": "c592fb9e37980e942d712b25d877217dd74e54b85768e90e6a55d4e507d37d17"
  }
}
